"id","name","academicProgramId"
544,"Avaliação Psicológica da Criança e do Adulto",89
545,"Conferência",155
546,"Text Mining",12
547,"Modelos de Liderança na Gestão Pública",155
548,"Desenvolvimento de Competências Profissionais",58
549,"Organizações Internacionais, Ongs e Movimentos Sociais",75
550,"Seminário de Acompanhamento do Projeto de Doutoramento em Ciências e Tecnologias da Informação",11
551,"Inteligência e Gestão de Redes e Serviços",28
552,"Reporte Financeiro",8
553,"Direito e Política Nacional do Mar",57
554,"E-Business",110
555,"Direito e Regulação do Ambiente",128
556,"Gestão de Projeto e de Obra",13
557,"Análise e Desenho de Políticas Públicas",172
558,"Dissertação em Estudos Urbanos",48
559,"Economia da Inovação e do Conhecimento",142
560,"Trabalho em Equipa",18
561,"Competências Académicas I",3
562,"Direitos Humanos e Serviço Social",104
563,"Seminário de Investigação em Arquitetura dos Territórios Metropolitanos Contemporâneos",59
564,"Treino de Competências Académicas em Psicologia (2020)",154
565,"Simulação de Sistemas e Operações",106
566,"Turismo de Compras e Gestão de Retalho de Luxo",78
567,"Contratação Pública e Fiscalização",139
568,"Deontologia e Competências Profissionais em Grh",19
569,"Internet das Coisas para Cidades Inteligentes",121
570,"Dissertação em Estudos Internacionais",75
571,"Metodologias de Planeamento",22
572,"Sistemas de Informação: Bibliotecas e Arquivos",63
573,"Geografia I",13
574,"História e Imagem",137
575,"Métodos Numéricos",77
576,"Desenho de Sistemas de Informação",153
577,"Escrita de Textos Técnicos e Científicos",84
578,"Arquitectura III",13
579,"Macroeconomia e Análise de Conjuntura",90
580,"Gestão Urbana (2020)",13
581,"Diásporas Africanas, Migrações e Direitos",81
582,"Fundamentos de Contabilidade de Gestão",10
583,"Desenvolvimento do Desenho e Organização do Projecto de Investigação em Gestão Empresarial Aplicada",87
584,"Sistemas Políticos Comparados",96
585,"Comunicação em Educação",167
586,"Estado, Economia e Políticas Públicas",92
587,"Seminário em Gestão de Sistemas de Informação 2 (2018)",153
588,"Avaliação e Peritagem de Obras de Arte",79
589,"Temas Críticos de Recursos Humanos em Hotelaria",113
590,"Gestão de Conflitos e Negociação",19
591,"Design Thinking e Estratégias de Inovação",155
592,"Análise de Dados em Ciências Sociais - Descritiva",22
593,"Arquitectura I",13
594,"Psicologia das Organizações e do Trabalho",125
595,"Psicologia Comunitária",127
596,"Análise Prescritiva",98
597,"Dissertação em Ciência Política",160
598,"Análise de Campanhas Políticas",30
599,"Economia e Políticas Europeias (2018)",92
600,"Métodos Quantitativos para as Finanças",60
601,"Seminário de Investigação em Economia I (2.º Ciclo)",1
602,"Teoria e História da Arquitetura II",13
603,"Liderança e Governança Organizacional",167
604,"Seminário II: Economia Social e Solidária e as Economias 'Alternativas'",161
605,"Instituições Políticas",96
606,"Métodos e Técnicas de Investigação em Ciências Sociais",24
607,"Diagnóstico e Mudança Organizacional",19
608,"Laboratório de Elaboração de Projectos em Ciência Política",96
609,"Introdução A Modelos Dinâmicos",25
610,"Português Como Língua Estrangeira - Iniciação",4
611,"Gestão das Operações e da Cadeia de Abastecimento",10
612,"Pesquisa Bibliográfica e Análise da Informação",182
613,"Economia do Ambiente e dos Recursos Naturais",167
614,"Dissertação em Governação e Sustentabilidade do Mar",57
615,"Gestão de Recursos Humanos e de Equipas",10
616,"Tese de Doutoramento em Ciências da Complexidade (120ects) (0 Ects)",37
617,"Ciências Sociais e Ação Humanitária (Mes)",55
618,"Metodologias de Investigação Aplicadas às Políticas de Administração e Gestão Escolar",141
619,"Dissertação em História Moderna e Contemporânea",184
620,"Auditoria Pública",139
621,"Bases de Dados Distribuídas Avançadas",98
622,"Fundamentos de Economia",77
623,"Inventário e Interpretação Patrimonial",156
624,"Dissertação em Ciências do Trabalho e Relações Laborais",133
625,"Migrações Contemporâneas",103
626,"História das Teorias Económicas",161
627,"Seminário de Investigação em Marketing",29
628,"Opinião Pública e Sondagens",30
629,"Desenvolvimento Emocional na Família e na Escola",61
630,"Teorias em Média e Comunicação",36
631,"Seminário de História I (2020)",38
632,"Relações Europa-África",30
633,"Seminário de Investigação em Gestão de Serviços de Saúde (3ects)",15
634,"Macroeconometria I",118
635,"Sociedade da Informação e do Conhecimento",132
636,"Economia do Turismo",167
637,"Gestão de Recursos Humanos (2ºciclo)",15
638,"Desenho de Projeto para Ciência de Dados",93
639,"Fundamentos de Programação",80
640,"Diagnóstico e Intervenção Social e Organizacional",58
641,"Gestão Integrada das Operações",32
642,"Empreendedorismo",32
643,"Tópicos de Matemática I",25
644,"Economia e Políticas de Desenvolvimento",94
645,"Análise de Dados em Gestão de Recursos Humanos III",19
646,"Construção de Projeto em Antropologia",134
647,"Psicologia Organizacional",167
648,"Finanças de Empresa",32
649,"Métodos de Investigação em Ciências e Tecnologias da Informação",11
650,"Novas Perspectivas em História Moderna",184
651,"Comunicação Visual II",13
652,"Marketing Pessoal",167
653,"Tese em Ciência Política (0 Ects)",145
654,"Introdução à Estatística",143
655,"Dissertação em Engenharia Informática (2020)",31
656,"Enoturismo e Negócio do Vinho",78
657,"Urbanismo II",13
658,"História da Psicologia",3
659,"Microeconomia",69
660,"Leituras Etnográficas",47
661,"Sistemas de Recursos Humanos e Gestão de Recompensas",35
662,"Investigação Qualitativa",130
663,"História Oral",137
664,"Metodologia de Desenho Amostral e Estimação",52
665,"Estatística e Análise de Dados II",3
666,"Economia Global e Internacionalização das Empresas",85
667,"Cidade, Migrações e Diversidade",48
668,"Estratégias Empresariais e Instrumentos de Gestão na Economia Solidária",159
669,"Métodos de Análise de Multimédia",30
670,"Gestão das Organizações Escolares",34
671,"Política Industrial e Competitividade",92
672,"Seminário de Investigação em Contabilidade",126
673,"Comunicação Integrada em Marketing",53
674,"Comunicação e Negociação Intercultural",177
675,"Excel Avançado",4
676,"Fundamentos de Sinais e Sistemas",14
677,"Dissertação em Políticas Públicas",147
678,"Seminário em Estudos Internacionais",173
679,"Formação do Portugal Moderno",63
680,"Métodos Quantitativos",74
681,"Gestão de Activos Financeiros",8
682,"Cultura Arquitetónica (2020)",13
683,"Dinâmicas Sociais da Internet",171
684,"Estratégia de Marketing",29
685,"Introdução à Sustentabilidade",4
686,"Economia Política Comparada (2º Ciclo)",166
687,"Gestão Integrada de Projectos",167
688,"Leituras em Economia Política",166
689,"Fusões, Aquisições e Avaliação de Empresas",167
690,"Introdução à Sociologia (Dcse)",124
691,"Fundamentos de Finanças da Empresa",167
692,"Fiscalidade",43
693,"Ética, Responsabilidade e Sustentabilidade Empresarial",74
694,"Gestão de Projectos de Sistemas de Informação",153
695,"Seminário de Projecto em Ciências da Comunicação",95
696,"Investigação Operacional I",105
697,"Processamento de Informação",23
698,"Metodologias em Políticas Públicas: o Método Comparativo",70
699,"Tese em Serviço Social (0 Ects)",68
700,"Poderes: o Económico e o Político",47
701,"Gestão de Bases de Dados",176
702,"Portugal no Estado Novo",63
703,"Análise de Dados em Ciências Sociais: Multivariada I",96
704,"Estatística",17
705,"Direito Fiscal das Empresas",99
706,"Análise e Finanças de Empresa",19
707,"Abordagens à Psicopatologia",24
708,"Bases de Dados",5
709,"Dissertação em Ação Humanitária",55
710,"Relações Internacionais na Época Contemporânea",145
711,"Gestão do Retalho",105
712,"Metodologias de Investigação em Gestão Empresarial Aplicada",87
713,"Econometria II",17
714,"Estágio em Políticas Públicas",147
715,"Fundamentos de Gestão (6ects)",79
716,"Métodos e Áreas de Aplicação da Psicologia",3
717,"Matemática e Métodos Numéricos para Economia e Finanças I",64
718,"Estágio em Psicologia Comunitária",89
719,"Análise de Indicadores Estatísticos",30
720,"Marketing Cultural",20
721,"Direito da Educação",34
722,"Teorias Sociológicas Clássicas",50
723,"Marketing Intelligence",53
724,"Organizações, Profissões e Criatividade",181
725,"Narrativas Digitais e Entretenimento Transmedia",131
726,"Seminário de Projecto em Ciência Política e Relações Internacionais",145
727,"Seminário de Teorias e Práticas do Desenvolvimento",115
728,"Métodos de Investigação Quantitativos",3
729,"Atitudes e Comportamentos Políticos",160
730,"Estratégia e Valor Público (Forgep)",72
731,"História e Cultura Portuguesa",30
732,"Pesquisa / Elaboração de Projeto em Antropologia 1",103
733,"Eleições, Partidos e Representação Política",76
734,"Introdução à Investigação em Ciências e Tecnologias de Informação",107
735,"Métodos de Pesquisa Qualitativos em Gestão Empresarial Aplicada",87
736,"Média e Opinião Pública",36
737,"Estatística e Análise de Dados",122
738,"História do Capitalismo e da Democracia",124
739,"Relações de Trabalho e Sindicalismo",133
740,"Métodos Analíticos na Gestão",167
741,"Inovação e Políticas Verdes",162
742,"Marketing Global",110
743,"Tópicos de Matemática para Computação",23
744,"Álgebra",10
745,"Derivados e Gestão de Risco",77
746,"Dissertação em Engenharia de Telecomunicações e Informática (2020)",28
747,"Modulação e Codificação",14
748,"Fundamentos de Business Analytics",98
749,"Turismo e Património",109
750,"Psicometria",3
751,"Concepção e Avaliação de Projectos",115
752,"Desafios Atuais na Gestão de Recursos Humanos",35
753,"Seminário de Desenvolvimento Científico em Gestão",130
754,"Práticas de Trabalho Universitário",47
755,"Introdução à Ciência de Dados",123
756,"As Revoluções Liberais em Portugal",63
757,"Análise de Dados em Marketing",53
758,"Workshop de Discussão",155
759,"Projecto de Arquitectura I",13
